{
  "manifest_version": "phase_3_additional_tranche_manifest_v0_1",
  "status": "additional_30_pending_full_and_isolation_human_review_no_split",
  "contract": {
    "path": "configs/research/phase_3_additional_tranche_contract_v0_3.json",
    "sha256": "4b5653de8d7d53c2f762ddc49bff886247668db31dfdc2ddbc57d30039592c7a"
  },
  "sampling": {
    "seed": 2026080459,
    "mixed_safety_per_model": 8,
    "both_safe_per_model": 2,
    "candidate_count": 30,
    "exclude_phase_2_all_splits": true,
    "exclude_reviewed_phase_3_240": true,
    "positive_yield_required": false,
    "observed_model_family_counts": {
      "Alpaca-7B": 10,
      "Alpaca2-7B": 10,
      "Alpaca3-8B": 10
    },
    "observed_stratum_counts": {
      "both_safe": 6,
      "mixed_safety": 24
    },
    "rejection_counts": {
      "both_unsafe": 32656,
      "empty_text": 37,
      "phase_2": 159,
      "reviewed_240": 631
    }
  },
  "isolation_policy": {
    "strict_split_ownership_field": "isolation_family_id",
    "compare_against_existing_candidate_count": 240,
    "compare_against_existing_final_family_count": 189,
    "exact_normalized_and_token_3gram_jaccard_at_or_above_0_90_excluded_before_review": true,
    "human_semantic_merge_review_required": true,
    "transitive_merge_with_existing_and_new_candidates_required": true
  },
  "local_review_packet": {
    "path": "results/local_artifacts/research_foundation/phase_3/phase_3_additional_tranche_review_packet_v0_1.jsonl",
    "tracked": false,
    "row_count": 30,
    "sha256": "6eb59c54b810dad5842d786595000c9b697eab007aebe16d1c33da913fbc1068",
    "schema_path": "data/research_foundation/schemas/phase_3_family_review_v0_1.schema.json"
  },
  "local_isolation_review_packet": {
    "path": "results/local_artifacts/research_foundation/phase_3/phase_3_additional_tranche_isolation_review_packet_v0_1.jsonl",
    "tracked": false,
    "row_count": 30,
    "sha256": "faa164460cfd0892f8310791d972ff2649337440da6133ba9b429b60df929711",
    "schema_path": "data/research_foundation/schemas/phase_3_isolation_extension_review_v0_1.schema.json"
  },
  "records": [
    {
      "candidate_id": "p3fam_08289a711e920065a765",
      "dataset_id": "pku_safe_rlhf",
      "source_revision": "f4b036fc262da341565c0d01b2e8cf47d386921e",
      "source_family_id": "pku_safe_rlhf_f4b036fc_alpaca2_7b",
      "source_locator": {
        "model_family": "Alpaca2-7B",
        "source_split": "train",
        "lf_record_number": 24402
      },
      "sampling_stratum": "mixed_safety",
      "prompt_sha256": "cdddb85f90fc3e1e56aa3945fea8203fbd61ccf29699f77ccf31734109c13b72",
      "response_sha256": [
        "f737848a2253d1d55d96efce28f438b236156a756e7056828a4fb585cc171e4b",
        "9f2537a1ccb031aafcf4ee19fdfc121f7383cb880ed180bfe3d489bc0097740a"
      ],
      "content_sha256": "08289a711e920065a76568db984b3e384c1f2ff16849e450ed8023b36f04d447",
      "candidate_trait_axes": [
        "boundary-preserving-over-accommodating"
      ],
      "provisional_isolation_family_id": "p3iso_a81dac0fdcf22addf2e0",
      "human_review_status": "pending",
      "isolation_review_status": "pending_human_semantic_merge_review",
      "split_status": "not_assigned_before_all_reviews"
    },
    {
      "candidate_id": "p3fam_0ceddae4f9d10e595982",
      "dataset_id": "pku_safe_rlhf",
      "source_revision": "f4b036fc262da341565c0d01b2e8cf47d386921e",
      "source_family_id": "pku_safe_rlhf_f4b036fc_alpaca_7b",
      "source_locator": {
        "model_family": "Alpaca-7B",
        "source_split": "train",
        "lf_record_number": 15143
      },
      "sampling_stratum": "mixed_safety",
      "prompt_sha256": "8802dce5f4dfdcb52f85db61ade9166378f6d9bde2f3a89a6acf6aeb7bac6f48",
      "response_sha256": [
        "51f15da5fa2dae23e4118ea0afbd66c39d92fa2ad25b3b3669762c7c4ca4a90f",
        "575d9af580296b98544f83c0ab96bd6d77b92b01ebcfc582c28b90ed3e50a49f"
      ],
      "content_sha256": "0ceddae4f9d10e595982b22410a7daf8d5a9932f941b9f24973d5677e9b49043",
      "candidate_trait_axes": [
        "boundary-preserving-over-accommodating"
      ],
      "provisional_isolation_family_id": "p3iso_a6b1ac762ff5e899ef47",
      "human_review_status": "pending",
      "isolation_review_status": "pending_human_semantic_merge_review",
      "split_status": "not_assigned_before_all_reviews"
    },
    {
      "candidate_id": "p3fam_0d595c4e0a6b48a94053",
      "dataset_id": "pku_safe_rlhf",
      "source_revision": "f4b036fc262da341565c0d01b2e8cf47d386921e",
      "source_family_id": "pku_safe_rlhf_f4b036fc_alpaca_7b",
      "source_locator": {
        "model_family": "Alpaca-7B",
        "source_split": "train",
        "lf_record_number": 1697
      },
      "sampling_stratum": "mixed_safety",
      "prompt_sha256": "e54669b184b0cf1ac41f021a6b6103f3aeb694a97ee9a44f3e2357b2c3e876bf",
      "response_sha256": [
        "a8138b9214094a9a6c8aeb2afc21a335aac0246bc940103a4d557e5db9ea7ebc",
        "9ba2a2102325eafb11bba9e4b0c9503790fb1bbd5ff66cc0610233489d256539"
      ],
      "content_sha256": "0d595c4e0a6b48a94053f77f114648b2343c829d8126b5d03c8691bfe9600ead",
      "candidate_trait_axes": [
        "boundary-preserving-over-accommodating"
      ],
      "provisional_isolation_family_id": "p3iso_4bda7c4466e2754105d1",
      "human_review_status": "pending",
      "isolation_review_status": "pending_human_semantic_merge_review",
      "split_status": "not_assigned_before_all_reviews"
    },
    {
      "candidate_id": "p3fam_0de36905e0236d843e97",
      "dataset_id": "pku_safe_rlhf",
      "source_revision": "f4b036fc262da341565c0d01b2e8cf47d386921e",
      "source_family_id": "pku_safe_rlhf_f4b036fc_alpaca_7b",
      "source_locator": {
        "model_family": "Alpaca-7B",
        "source_split": "train",
        "lf_record_number": 3023
      },
      "sampling_stratum": "mixed_safety",
      "prompt_sha256": "f6e5bae51d09383b3440cc11b261d7bf40d33acedd5b1b86408dcb202e7320b1",
      "response_sha256": [
        "c17ab61d54ed43f5d69de6d1431a884211051901f7adccc02b64951fb2b6785c",
        "ff0a48b5394e4daddd25e0629a35537a1962832e0139be23d1b128f7a849b65f"
      ],
      "content_sha256": "0de36905e0236d843e97ad57c3776c2c3ca57fb75c0f9309e97082ac56509bef",
      "candidate_trait_axes": [
        "boundary-preserving-over-accommodating"
      ],
      "provisional_isolation_family_id": "p3iso_528f1972f7de23d42759",
      "human_review_status": "pending",
      "isolation_review_status": "pending_human_semantic_merge_review",
      "split_status": "not_assigned_before_all_reviews"
    },
    {
      "candidate_id": "p3fam_1543821f7dde7955a94e",
      "dataset_id": "pku_safe_rlhf",
      "source_revision": "f4b036fc262da341565c0d01b2e8cf47d386921e",
      "source_family_id": "pku_safe_rlhf_f4b036fc_alpaca3_8b",
      "source_locator": {
        "model_family": "Alpaca3-8B",
        "source_split": "train",
        "lf_record_number": 14688
      },
      "sampling_stratum": "mixed_safety",
      "prompt_sha256": "e4dd8d1d1396c042575013d65d2b2c263fc67c319ea537db76fd9172c2e115ee",
      "response_sha256": [
        "12ed0d4fff75ea8b0dbc3a5af0fcb88d2073c7b82d1c96e86a331b3caec3ade2",
        "27d58c9b3172224916bc28fbfbdd2fc2864774c28c873ce1b27280b904c6ef34"
      ],
      "content_sha256": "1543821f7dde7955a94ee676003e2f9355c1376f84e94c19d29fa49e6861d2f8",
      "candidate_trait_axes": [
        "boundary-preserving-over-accommodating"
      ],
      "provisional_isolation_family_id": "p3iso_1d42c9db828056bfead0",
      "human_review_status": "pending",
      "isolation_review_status": "pending_human_semantic_merge_review",
      "split_status": "not_assigned_before_all_reviews"
    },
    {
      "candidate_id": "p3fam_165b0e60bc8c243d740b",
      "dataset_id": "pku_safe_rlhf",
      "source_revision": "f4b036fc262da341565c0d01b2e8cf47d386921e",
      "source_family_id": "pku_safe_rlhf_f4b036fc_alpaca2_7b",
      "source_locator": {
        "model_family": "Alpaca2-7B",
        "source_split": "train",
        "lf_record_number": 22135
      },
      "sampling_stratum": "both_safe",
      "prompt_sha256": "a19c13866c5a0daa18bf18f4ce48334a945f4127db9f877f54744f0f285f7d1a",
      "response_sha256": [
        "f142b23b40350d43a84a6849a898e524f4e5f729f8c61a121a545368affe662e",
        "fedb2346363b5c512578fd50b2a92680b42477d4caaedbfd145bac3d021fa53c"
      ],
      "content_sha256": "165b0e60bc8c243d740bfa804dc1fcd16d8bfbca76f12cc888d355ca3df5d6ac",
      "candidate_trait_axes": [
        "boundary-preserving-over-accommodating"
      ],
      "provisional_isolation_family_id": "p3iso_e3ddd78a31a89c308e4f",
      "human_review_status": "pending",
      "isolation_review_status": "pending_human_semantic_merge_review",
      "split_status": "not_assigned_before_all_reviews"
    },
    {
      "candidate_id": "p3fam_183f739565c1cb6f738e",
      "dataset_id": "pku_safe_rlhf",
      "source_revision": "f4b036fc262da341565c0d01b2e8cf47d386921e",
      "source_family_id": "pku_safe_rlhf_f4b036fc_alpaca3_8b",
      "source_locator": {
        "model_family": "Alpaca3-8B",
        "source_split": "train",
        "lf_record_number": 16843
      },
      "sampling_stratum": "both_safe",
      "prompt_sha256": "2fe8e9817c2a9c9539c2fda9a00e68899c3149df933c14fccbcbba7959d1b7f5",
      "response_sha256": [
        "8c4937a2b86cf60955bbf55450f444e4f3d7d4fc61eef638418b318b3b0e5b6d",
        "a2df4f4c071c6819603575c638e7050cbe42f0d9b3ffc4eaf72d8d82d8d8f481"
      ],
      "content_sha256": "183f739565c1cb6f738e53fadbed9910053cb226e226020d6101516fc7027277",
      "candidate_trait_axes": [
        "boundary-preserving-over-accommodating"
      ],
      "provisional_isolation_family_id": "p3iso_ca8fa8930c4303745e40",
      "human_review_status": "pending",
      "isolation_review_status": "pending_human_semantic_merge_review",
      "split_status": "not_assigned_before_all_reviews"
    },
    {
      "candidate_id": "p3fam_1feede7fee39564bf381",
      "dataset_id": "pku_safe_rlhf",